,course_id,course_title,url,is_paid,price(USD),num_subscribers,level,duration(Hours),subject
2617,134144,Ruby on Rails: Training and Skills to Build Web Applications,https://www.udemy.com/the-startups-guide-to-web-development-with-ruby-on-rails/,True,95,9375,All Levels,7.0,Web Development
2618,1115222,Learn and Understand React,https://www.udemy.com/learn-and-understand-react-and-redux-i/,True,30,4848,All Levels,16.5,Web Development
2619,94430,Learn Javascript & JQuery From Scratch,https://www.udemy.com/learn-javascript-jquery-from-scratch/,True,30,84897,All Levels,2.0,Web Development
2620,788514,Learn to use JSON,https://www.udemy.com/learn-to-use-json/,True,150,12838,Beginner Level,1.5,Web Development
2621,629142,The Ultimate Web Developer How To Guide,https://www.udemy.com/learn-web-development-complete-step-by-step-guide-to-success/,True,200,24861,All Levels,22.5,Web Development
2622,992114,"Build A Complete CRUD Application With PHP, MYSQL & JQUERY",https://www.udemy.com/build-a-complete-crud-application-with-php-mysql-jquery/,True,20,9762,All Levels,13.5,Web Development
2623,379722,jQuery Crash Course: Learn the Essentials of jQuery Fast,https://www.udemy.com/learn-jquery-crash-course/,True,50,11262,All Levels,2.0,Web Development
2624,1189288,Drupal Tutorial : Drupal 8 Beginner to Expert in 8 PROJECTS,https://www.udemy.com/drupal-tutorial/,True,200,1270,Beginner Level,7.0,Web Development
2625,652438,The Complete PHP CodeIgniter Course: Beginner To Advanced,https://www.udemy.com/codeignitercourse/,True,195,17895,All Levels,4.0,Web Development
2626,1052304,JavaScript For Beginners : Learn JavaScript From Scratch,https://www.udemy.com/javascript-course-for-beginners/,True,195,11285,All Levels,5.5,Web Development
2627,1223012,"Mastering 'Native CSS Shapes To Build Modern Web Pages""",https://www.udemy.com/mastering-native-css-shapes/,True,195,1040,All Levels,3.5,Web Development
2628,882488,WordPress Development For Beginners,https://www.udemy.com/wordpress-basic/,True,95,23572,All Levels,2.0,Web Development
2629,1033686,WordPress local server setup and site migration online,https://www.udemy.com/wordpress-local-install-and-two-methods-to-migrate-online/,True,55,3801,All Levels,1.0,Web Development
2630,723522,PHP Fundamentals - Start Earning The Top Dollars You Deserve,https://www.udemy.com/php-fundamentals/,True,195,12068,All Levels,1.5,Web Development
2631,1181900,Interactive Dynamic JavaScript for beginners DOM,https://www.udemy.com/javascript-dom/,True,200,5559,Beginner Level,2.0,Web Development
2632,945336,Javascript Intermediate level 1 - Mastering the DOM,https://www.udemy.com/javascript-intermediate-mastering-the-dom/,True,100,1838,All Levels,3.0,Web Development
2633,1079370,Sublime Text for Rapid Web Development,https://www.udemy.com/sublime-text-for-rapid-web-development/,True,20,2104,All Levels,1.0,Web Development
2634,23742,Servlets and JSPs Tutorial: Learn Web Applications With Java,https://www.udemy.com/javawebtut/,True,35,15187,All Levels,10.0,Web Development
2635,266252,Projects in PHP and MySQL,https://www.udemy.com/the-complete-web-development-course-learn-by-building-apps/,True,60,10606,All Levels,23.0,Web Development
2636,473548,PHP OOP: Object Oriented Programming for beginners + Project,https://www.udemy.com/oop-php-object-oriented-programing-with-project-1-course/,True,200,6497,All Levels,18.0,Web Development
2637,920544,React Redux React-Router: From Beginner to Paid Professional,https://www.udemy.com/react-redux-react-router/,True,20,11536,All Levels,6.5,Web Development
2638,993754,Django Core | A Reference Guide to Core Django Concepts,https://www.udemy.com/django-core/,True,195,16282,Intermediate Level,18.5,Web Development
2639,1155262,"Angular 2 Complete E-Commerce App Course - Java,Spring,MySQL",https://www.udemy.com/build-angular-2-complete-e-comerce-app-java-spring-mysql/,True,195,949,All Levels,20.5,Web Development
2640,997964,"Build An Online Bank With Java, Angular 2, Spring and More",https://www.udemy.com/build-an-online-bank-with-java-angular-2-spring-and-more/,True,195,1995,Beginner Level,6.5,Web Development
2641,812588,The Complete jQuery Course: From Beginner To Advanced!,https://www.udemy.com/jquery-tutorial/,True,195,6636,All Levels,6.0,Web Development
2642,531954,Projects in AngularJS - Learn by building 10 Projects,https://www.udemy.com/learn-angularjs-development/,True,40,7146,All Levels,14.5,Web Development
2643,1022582,The Ultimate Vue JS 2 Developers Course,https://www.udemy.com/vuejs-2-essentials/,True,195,1703,All Levels,13.0,Web Development
2644,1049092,React JS - Build real world JS apps & deploy on cloud,https://www.udemy.com/reactjs-for-beginners-build-real-world-react-apps-deploy-on-cloud/,True,175,12815,All Levels,8.5,Web Development
2645,1277924,Angular 4 Front To Back,https://www.udemy.com/angular-4-front-to-back/,True,40,44,All Levels,8.5,Web Development
2646,964732,"Modern Web Development with SASS, Gulp, NPM & Web Workflows",https://www.udemy.com/modern-web-development-with-sass-gulp-npm-web-workflows/,True,95,502,Beginner Level,5.0,Web Development
2647,947120,"HTML5, CSS3 And JavaScript Fundamentals 2016",https://www.udemy.com/html5-css3-and-javascript-fundamentals-2016/,True,115,627,All Levels,1.0,Web Development
2648,712960,"Angular 4 - Concepts, Code and Collective Wisdom",https://www.udemy.com/angular-2-concepts-code-and-collective-wisdom/,True,50,851,Intermediate Level,4.5,Web Development
2649,267560,Learn E-Commerce Website in PHP & MySQL From Scratch!,https://www.udemy.com/ecommerce-website-in-php-mysqli/,False,0,29990,All Levels,17.5,Web Development
2650,763774,JavaScript Game Development: Create Your Own Breakout Game,https://www.udemy.com/javascript-game-development-create-your-own-breakout-game/,False,0,10179,All Levels,1.5,Web Development
2651,929016,HTML and HTML5 For Beginners 2016,https://www.udemy.com/html-and-html5-for-beginners-2016/,True,200,563,All Levels,3.0,Web Development
2652,281690,A Very Complete Introduction To Laravel,https://www.udemy.com/laravel-4-beginners/,True,20,2320,All Levels,6.0,Web Development
2653,399228,"Learn to code, Become a Web Developer and Master JavaScript!",https://www.udemy.com/master-javascript-today/,True,200,2353,All Levels,10.0,Web Development
2654,1023062,Serverless Architecture on Amazon Web Services,https://www.udemy.com/serverless-architecture-on-aws/,False,0,13210,Intermediate Level,0.55,Web Development
2655,933260,jQuery Essentials: Learn the Fundamental of jQuery,https://www.udemy.com/jquery-essentials/,True,20,1004,All Levels,3.5,Web Development
2656,494078,Expert Guide : Mastering Functions in JavaScript !,https://www.udemy.com/functions-in-javascript/,True,195,3015,All Levels,2.5,Web Development
2657,1158572,Learn Angular 4 from Scratch,https://www.udemy.com/learn-angular-from-scratch/,False,0,8693,Beginner Level,1.5,Web Development
2658,629082,Discover HTML Essential guide to HTML how to create webpages,https://www.udemy.com/intro-to-html-beginners-guide-to-html-how-to-create-webpages/,True,85,8711,Beginner Level,1.5,Web Development
2659,1093734,HTML5 and CSS3 for beginners: Create a Website from Scratch,https://www.udemy.com/html5-and-css3-for-beginners-create-a-website-from-scratch/,True,200,9945,Beginner Level,2.0,Web Development
2660,99986,Introduction to Web Development,https://www.udemy.com/introduction-to-web-development/,True,20,18143,Beginner Level,2.0,Web Development
2661,566248,jQuery Fundamentals Powerful Bootcamp for beginners,https://www.udemy.com/jquery-fundamentals-bootcamp-learn-how-to-use-jquery/,True,150,13882,All Levels,3.0,Web Development
2662,556248,The Complete HTML & CSS Course - From Novice To Professional,https://www.udemy.com/htmlwebsite/,True,195,57422,All Levels,7.5,Web Development
2663,582392,JavaScript Basics Web Development Building Blocks,https://www.udemy.com/javascript-basics-web-development-building-blocks/,True,95,10179,Beginner Level,1.5,Web Development
2664,582636,Bootstrap unleash the power faster & easier web development,https://www.udemy.com/bootstrap-3-responsive-design-tutorial-fundamentals/,True,150,18101,All Levels,5.5,Web Development
2665,661802,JavaScript Design Patterns: 20 Patterns for Expert Code,https://www.udemy.com/javascript-design-patterns-20-patterns-for-expert-code/,True,95,2789,Expert Level,3.5,Web Development
2666,1139400,Fix Google's New 'Not Secure' Warning with Let's Encrypt!,https://www.udemy.com/fix-googles-new-not-secure-warning-with-lets-encrypt/,True,95,1437,Beginner Level,1.0,Web Development
2667,729552,JavaScript for Beginners Welcome to learning JavaScript,https://www.udemy.com/javascript-for-beginners-course/,True,50,10864,Beginner Level,2.0,Web Development
2668,499632,Benefits of Thinking Mobile First Future of Website Design,https://www.udemy.com/thinking-mobile-websites-smart-design-tutorial/,True,75,14254,Beginner Level,1.5,Web Development
2669,959586,Javascript from Beginner to Advanced Level,https://www.udemy.com/javascript-from-beginner-to-advanced-level/,True,195,6134,Beginner Level,6.5,Web Development
2670,16151,AJAX Development,https://www.udemy.com/ajax-development/,True,20,7867,All Levels,3.0,Web Development
2671,856490,Interaction Design Specialist For Web Developers,https://www.udemy.com/interaction-design-specialist-for-web-developers/,True,95,8594,All Levels,2.0,Web Development
2672,861528,PHP Security,https://www.udemy.com/php-security/,True,50,1892,All Levels,2.5,Web Development
2673,912996,The Bubble Course - Create Complete Web Apps without Coding,https://www.udemy.com/bubble-course/,True,30,3960,Beginner Level,4.5,Web Development
2674,559512,The Complete HTML5 & CSS3 Course Build Professional Websites,https://www.udemy.com/html5css3/,True,195,10518,All Levels,4.5,Web Development
2675,922600,CSS Web Development Crash Course,https://www.udemy.com/css-course/,True,20,10008,Beginner Level,2.5,Web Development
2676,976284,Mastering DevOps,https://www.udemy.com/mastering-devops/,True,100,1023,Intermediate Level,6.0,Web Development
2677,976598,Building Websites Create a fully functional Web contact form,https://www.udemy.com/how-to-create-a-fully-functional-web-contact-form/,True,200,3392,Beginner Level,1.5,Web Development
2678,718426,Create a Dynamic User Registration Form from scratch,https://www.udemy.com/create-a-dynamic-user-registration-form-from-scratch/,True,100,7213,Beginner Level,3.0,Web Development
2679,304490,A 13 Hour SQL Server 2014 /ASP.NET/CSS/C#/jQuery Course,https://www.udemy.com/learnsqlwithsqlserver2014/,True,35,4183,Intermediate Level,14.0,Web Development
2680,15285,HTML Workshop,https://www.udemy.com/html-workshop/,True,20,25854,All Levels,2.0,Web Development
2681,477702,Python for Beginners: Python Programming Language | Tutorial,https://www.udemy.com/python-course/,True,150,6153,Beginner Level,5.0,Web Development
2682,875882,Creating Animations using HTML5 Canvas,https://www.udemy.com/hmtl5-canvas-animations/,True,25,4010,All Levels,1.0,Web Development
2683,861122,Bootstrap 4: Exploring New Features,https://www.udemy.com/bootstrap-40exploring-new-features/,True,75,5022,All Levels,1.0,Web Development
2684,309370,Bootstrap 3 -> Profitable WordPress Theme Development!,https://www.udemy.com/bootstrap-wordpress/,True,40,5547,All Levels,3.5,Web Development
2685,802268,Intro to Git,https://www.udemy.com/intro-to-git/,True,20,2532,Beginner Level,1.0,Web Development
2686,1034520,WordPress Domination #2: Leads & Scarcity,https://www.udemy.com/wordpress-domination-2-leads-and-scarcity/,True,95,2362,Beginner Level,1.0,Web Development
2687,1016536,Learn How to Manage & Customize  Web Sites By Drupal CMS,https://www.udemy.com/drupal-course/,True,140,7741,All Levels,2.5,Web Development
2688,711592,Using Modern JavaScript Today,https://www.udemy.com/using-modern-javascript/,True,50,1658,Intermediate Level,16.5,Web Development
2689,1065250,Up and Running with jQuery,https://www.udemy.com/up-and-running-with-jquery/,False,0,3324,All Levels,5.0,Web Development
2690,928858,Learn How To Build A Professional Web Site By Using Joomla,https://www.udemy.com/learn-how-to-build-a-professional-web-site-by-using-joomla/,True,70,7184,All Levels,4.0,Web Development
2691,791030,Power up HTML5 with JavaScript,https://www.udemy.com/power-up-html5-with-javascript/,True,100,4442,Beginner Level,2.0,Web Development
2692,1241518,Node Package Manager Course: Build and Publish NPM Modules,https://www.udemy.com/node-package-manager-course-build-and-publish-npm-modules/,True,30,7196,All Levels,6.5,Web Development
2693,944886,WordPress Look and Feel with Themes,https://www.udemy.com/learn-wordpress-customize-look-and-feel-with-themes/,True,25,2371,Beginner Level,1.0,Web Development
2694,758582,PHP with Laravel for beginners - Become a Master in Laravel,https://www.udemy.com/php-with-laravel-for-beginners-become-a-master-in-laravel/,True,150,8496,All Levels,29.5,Web Development
2695,1199774,JavaScript 2017: Become Top Rated Web Developer,https://www.udemy.com/become-professional-javascript-developer/,True,115,1346,All Levels,3.0,Web Development
2696,390866,The Complete Web Developer Bootcamp - Beginner to Expert,https://www.udemy.com/job-ready-web-developer/,True,190,14103,All Levels,21.5,Web Development
2697,1014776,Full-Stack Web Apps with Meteor and React,https://www.udemy.com/meteor-react/,True,85,3295,All Levels,31.5,Web Development
2698,929130,Angular 4: From Theory to Practice & FREE E-Book,https://www.udemy.com/angular-2-from-theory-to-practice/,True,200,4375,Intermediate Level,15.5,Web Development
2699,746014,The Complete Sass & SCSS Course: From Beginner to Advanced,https://www.udemy.com/sasscourse/,True,195,12021,All Levels,4.0,Web Development
2700,11475,Become a Certified Web Developer,https://www.udemy.com/become-a-certified-web-developer/,True,100,26673,All Levels,12.0,Web Development
2701,11174,Become a Web Developer from Scratch,https://www.udemy.com/how-to-become-a-web-developer-from-scratch/,True,120,69186,All Levels,27.5,Web Development
2702,945978,Ultimate Angular 4 (previously Angular 2) with Bootstrap 4,https://www.udemy.com/ultimate-angular-2/,True,50,11384,All Levels,5.5,Web Development
2703,1019276,The Ultimate Beginner's Guide to Django,https://www.udemy.com/the-ultimate-beginners-guide-to-django-python-web-dev-website/,True,200,2390,Beginner Level,9.0,Web Development
2704,1252630,React JS - Mastering Redux,https://www.udemy.com/react-js-mastering-redux/,True,100,7059,All Levels,5.0,Web Development
2705,1000010,Professional Ruby on Rails Developer with Rails 5,https://www.udemy.com/pro-ruby-on-rails-rails5/,True,200,3179,All Levels,20.5,Web Development
2706,937586,"Ruby on Rails 5 - BDD, RSpec and Capybara",https://www.udemy.com/ruby-rails-5-bdd-rspec-capybara/,True,200,1870,All Levels,14.5,Web Development
2707,79154,Back to School Web Development and Programming Bundle,https://www.udemy.com/back-to-school-web-development-and-programming-bundle/,True,200,18170,Beginner Level,44.5,Web Development
2708,328476,Complete ASP NET MVC Web Development - Newbie to Ninja!,https://www.udemy.com/better-web-development-pro-techniques-for-success/,True,195,6073,All Levels,9.0,Web Development
2709,921474,The Complete DevOps Engineer Course 2.0 - Java & Kubernetes,https://www.udemy.com/the-complete-devops-engineer-course-20-java-kubernetes/,True,195,5335,All Levels,14.0,Web Development
2710,82778,All about NodeJS,https://www.udemy.com/all-about-nodejs/,True,50,8755,All Levels,15.5,Web Development
2711,907386,How To Create A Wordpress Website 2016 | NEW Divi Theme 3.0!,https://www.udemy.com/how-to-create-a-wordpress-website-2016-new-divi-theme-30/,True,40,4144,Beginner Level,5.5,Web Development
2712,877124,The Complete jQuery Course - From Beginner to Professional!,https://www.udemy.com/complete-jquery-developer-course-beginner-to-pro/,True,200,6420,All Levels,22.5,Web Development
2713,1169378,Build a complete Fiverr clone with Node + Algolia + Paypal,https://www.udemy.com/web-developer-build-fiverr-twitter-and-mvp-with-nodejs/,True,30,1741,All Levels,9.0,Web Development
2714,30240,The Ultimate Web Development Course,https://www.udemy.com/build-an-instant-update-database-interface-with-jquery-ajax/,True,50,9881,All Levels,12.0,Web Development
2715,836044,React From The Ground Up,https://www.udemy.com/reactjs-from-the-ground-up/,True,150,3252,All Levels,12.5,Web Development
2716,405818,Javascript for Beginners Learn by Doing Practical Exercises,https://www.udemy.com/javascript-for-beginners-introduction-learn-fast-easy/,True,100,5089,All Levels,3.5,Web Development
2717,665042,8 Beautiful Ruby on Rails Apps in 30 Days & TDD - Immersive ,https://www.udemy.com/8-beautiful-ruby-on-rails-apps-in-30-days/,True,100,5962,All Levels,16.0,Web Development
2718,1068590,Wordpress Website Mastery 2017,https://www.udemy.com/wordpress-website-mastery-2017/,False,0,5181,Beginner Level,2.5,Web Development
2719,1203894,How To Make an eCommerce Website With Wordpress 2017,https://www.udemy.com/how-to-make-an-ecommerce-website-with-wordpress-2017/,False,0,3493,Beginner Level,4.5,Web Development
2720,994634,Mastering ASP.NET MVC 5 From Scratch Using C#,https://www.udemy.com/masteringaspnetmvc5/,True,50,417,All Levels,13.0,Web Development
2721,765916,Start Web Development with GIS Map in JavaScript,https://www.udemy.com/start-web-development-with-gis-map-in-javascript/,True,60,1599,All Levels,3.0,Web Development
2722,128950,Learn to Build Websites using Twitter Bootstrap,https://www.udemy.com/learn-to-build-websites-using-twitter-bootstrap/,False,0,15134,All Levels,2.5,Web Development
2723,549064,Web Development Tools the Pros Use: Code Productivity Hacks,https://www.udemy.com/web-development-tools/,True,30,2596,Beginner Level,4.0,Web Development
2724,400280,WordPress : An Overview,https://www.udemy.com/what-is-wordpress/,True,45,1783,Beginner Level,0.6,Web Development
2725,382856,Create Startup Landing Page with Viral Marketing Strategies,https://www.udemy.com/create-startup-landing-page-with-viral-marketing-strategies/,False,0,12974,Beginner Level,1.0,Web Development
2726,958982,JavaScript : JavaScript Awesomeness,https://www.udemy.com/javascript-javascript/,True,25,785,Beginner Level,1.0,Web Development
2727,1113036,Mastering CSS 3.0 Selectors,https://www.udemy.com/css3-selectors/,False,0,4115,Intermediate Level,2.0,Web Development
2728,226534,WordPress Backup And Restore Fundamentals,https://www.udemy.com/wordpress-backup-and-restore-fundamentals/,False,0,13242,Intermediate Level,1.0,Web Development
2729,738726,Learn HTML and CSS to make a Website,https://www.udemy.com/learn-html-and-css-to-make-website/,True,20,1154,Beginner Level,6.0,Web Development
2730,64422,1 Hour HTML,https://www.udemy.com/1-hour-html/,True,200,16212,Beginner Level,1.0,Web Development
2731,874166,Angular 2 Crash Course with TypeScript,https://www.udemy.com/angular-2-crash-course/,True,100,16409,All Levels,4.0,Web Development
2732,1197650,Boost your website speed without any coding!,https://www.udemy.com/boost-your-website-speed-without-any-coding/,True,50,1337,All Levels,1.0,Web Development
2733,912946,Professional Rails Code Along,https://www.udemy.com/professional-ruby-on-rails-coding-course/,True,40,1469,Intermediate Level,19.0,Web Development
2734,876544,ASP.NET Web API 2 Hands-On,https://www.udemy.com/aspnet-web-api-2-hands-on/,True,20,2660,All Levels,1.5,Web Development
2735,1205894,Create a MEAN App by Example - Full Stack Course,https://www.udemy.com/full-stack-course-mean-app/,True,50,421,Intermediate Level,3.5,Web Development
2736,19332,The Original Complete Web Developer Course.,https://www.udemy.com/thecompletewebdeveloper/,True,20,31070,Beginner Level,18.0,Web Development
2737,863954,Angular 2 From The Ground Up,https://www.udemy.com/angular-2-from-the-ground-up/,True,30,1737,All Levels,11.5,Web Development
2738,789324,Complete Web Development Course + Building 5 Websites!,https://www.udemy.com/creating-5-web-development-projects-in-html5-and-css3/,True,200,11492,All Levels,24.5,Web Development
2739,1229274,WP Plugin Development - Build your own plugin!,https://www.udemy.com/wp-plugin-development-build-your-own-plugin/,True,200,5439,Beginner Level,4.0,Web Development
2740,906700,Sass: From Beginner to Advanced,https://www.udemy.com/sass-from-beginner-to-advanced/,True,40,8059,All Levels,2.0,Web Development
2741,113706,Build Flat Responsive Website from Scratch - Complete Course,https://www.udemy.com/build-flat-responsive-website-from-scratch-complete-course/,True,35,12105,All Levels,7.5,Web Development
2742,604044,Wordpress for Beginners - Build a Live Website from Scratch,https://www.udemy.com/wordpress_for_beginners/,True,20,3877,Beginner Level,1.5,Web Development
2743,531290,"Essential JavaScript, jQuery and AngularJS Training",https://www.udemy.com/essential-javascript-jquery-angularjs-training/,True,30,2919,Intermediate Level,7.0,Web Development
2744,436210,The Pro Ruby on Rails Starter,https://www.udemy.com/pro-rubyonrails-starter/,True,45,2409,Beginner Level,2.5,Web Development
2745,617158,Unit Testing AngularJS: Build Bugfree Apps That Always Work!,https://www.udemy.com/unit-testing-angularjs/,True,25,2083,All Levels,2.5,Web Development
2746,1121580,WordPress Blog : Create a WordPress Website for Beginners,https://www.udemy.com/wordpress-website-for-beginners/,True,20,2076,Beginner Level,2.0,Web Development
2747,782192,Introduction to HTML5 Canvas basics of drawing,https://www.udemy.com/introduction-to-html5-canvas-basics-of-drawing/,True,200,2918,Beginner Level,1.0,Web Development
2748,978728,"Thoughtful Web Development Course: HTML, Vue.js, PHP, MySQL",https://www.udemy.com/web-development-html5-css3-php-oop-and-mysql-database/,True,200,842,All Levels,25.0,Web Development
2749,65493,Kids Coding - Beginners CSS,https://www.udemy.com/kids-coding-beginners-css/,True,100,7130,All Levels,1.0,Web Development
2750,32649,PHP & MySQL - Learn The Easy Way. Master PHP & MySQL Quickly,https://www.udemy.com/learning-php-and-mysql-development-the-easy-way/,True,50,5549,All Levels,15.5,Web Development
2751,1225030,Learning Path: Magento: Master and Test Magento 2 with Ease,https://www.udemy.com/learning-path-magento-master-and-test-magento-2-with-ease/,True,200,155,Expert Level,6.0,Web Development
2752,903140,The Complete hapiJS Course - Go From Beginner To Advanced!,https://www.udemy.com/hapijs-course/,True,195,1697,All Levels,6.0,Web Development
2753,372518,Ruby On Rails For Web Development,https://www.udemy.com/ruby-on-rails-for-web-development/,True,195,2526,Beginner Level,5.0,Web Development
2754,1045862,Create eye-catching WordPress website from scratch,https://www.udemy.com/create-eye-catching-wordpress-website-from-scratch/,True,30,2342,Beginner Level,4.5,Web Development
2755,99826,Become A Web Developer And Seller - Build Websites With HTML,https://www.udemy.com/the-ultimate-building-and-selling-websites-course/,True,200,21730,Beginner Level,2.5,Web Development
2756,1236746,WordPress Tips and Tricks,https://www.udemy.com/wordpress-tips-and-tricks/,True,200,1117,Intermediate Level,2.5,Web Development
2757,1110756,HTML Tutorials : HTML Code for Website Creating,https://www.udemy.com/html-code-for-website/,True,20,2401,All Levels,3.0,Web Development
2758,595728,Complete HTML5 and CSS3 Course +1 Start to Finish Project,https://www.udemy.com/complete-html5-and-css3-course-1-start-to-finish-project/,True,200,3887,All Levels,8.5,Web Development
2759,1231872,Web Development With HTML CSS BOOTSTRAP JQUERY for Beginners,https://www.udemy.com/web-development-with-html-css-bootstrap-jquery-for-beginners/,True,35,1156,Beginner Level,5.0,Web Development
2760,876850,HTML5 Specialist: Comprehensive HTML5 Training,https://www.udemy.com/html5-specialist/,True,100,1385,All Levels,5.0,Web Development
2761,113518,CSS and CSS3 For Absolute Beginners,https://www.udemy.com/css-and-css3-for-absolute-beginners/,True,75,10890,Beginner Level,5.0,Web Development
2762,1111552,Build a Complete JQuery Plugin (Image Pop-up Dialog),https://www.udemy.com/build-a-complete-jquery-plugin-image-pop-up-dialog/,True,20,1126,All Levels,1.0,Web Development
2763,834924,How to create HTML Forms,https://www.udemy.com/how-to-create-html-forms/,True,30,3652,Beginner Level,0.6666666666666666,Web Development
2764,764042,ReactJS and Flux: Learn By Building 10 Projects,https://www.udemy.com/reactjs-and-flux-learn-by-building-10-projects/,True,60,1723,All Levels,11.0,Web Development
2765,821526,How To Make A Business Website In 1 Day With Wix FAST & EASY,https://www.udemy.com/how-i-make-a-professional-website-in-1-day-or-less-with-wix/,True,20,3759,Beginner Level,4.0,Web Development
2766,838418,PHP Date and Time Course by Edwin Diaz,https://www.udemy.com/crash-course-learn-to-create-date-and-time-in-php-easily/,True,40,1653,All Levels,1.5,Web Development
2767,342084,Start Your Own Forum Website in 15 Minutes ,https://www.udemy.com/forum-web-development/,True,40,5387,All Levels,1.0,Web Development
2768,669536,Hit the ground running with AngularJS with Dion Yang,https://www.udemy.com/hit-the-ground-running-with-angularjs-with-dion-yang/,True,100,4563,All Levels,1.5,Web Development
2769,511378,Learn CSS Transition and Animation ,https://www.udemy.com/css-transition-and-animation/,True,100,3757,All Levels,1.0,Web Development
2770,553582,Learn JavaScript from scratch,https://www.udemy.com/learn-javascript-from-scratch/,True,20,4193,Beginner Level,2.5,Web Development
2771,566920,WordPress for Beginners - Tutorial - From Novice to Know-How,https://www.udemy.com/wordpress-for-beginners-tutorial-from-novice-to-know-how/,True,20,3694,Beginner Level,4.0,Web Development
2772,406820,RESTful API with Laravel,https://www.udemy.com/laravel-5-php-framework-agile-and-practical-php-restful-api/,True,45,1905,All Levels,6.0,Web Development
