,course_id,course_title,url,is_paid,price(USD),num_subscribers,level,duration(Hours),subject
0,1070968,Ultimate Investment Banking Course,https://www.udemy.com/ultimate-investment-banking-course/,True,200,2147,All Levels,1.5,Business Finance
1,1113822,Complete GST Course & Certification - Grow Your CA Practice,https://www.udemy.com/goods-and-services-tax/,True,75,2792,All Levels,39.0,Business Finance
2,1006314,Financial Modeling for Business Analysts and Consultants,https://www.udemy.com/financial-modeling-for-business-analysts-and-consultants/,True,45,2174,Intermediate Level,2.5,Business Finance
3,1210588,Beginner to Pro - Financial Analysis in Excel 2017,https://www.udemy.com/complete-excel-finance-course-from-beginner-to-pro/,True,95,2451,All Levels,3.0,Business Finance
4,1011058,How To Maximize Your Profits Trading Options,https://www.udemy.com/how-to-maximize-your-profits-trading-options/,True,200,1276,Intermediate Level,2.0,Business Finance
5,192870,Trading Penny Stocks: A Guide for All Levels In 2017,https://www.udemy.com/trading-penny-stocks-a-guide-for-all-levels/,True,150,9221,All Levels,3.0,Business Finance
6,739964,Investing And Trading For Beginners: Mastering Price Charts,https://www.udemy.com/investing-and-trading-for-beginners-mastering-price-charts/,True,65,1540,Beginner Level,1.0,Business Finance
7,403100,"Trading Stock Chart Patterns For Immediate, Explosive Gains",https://www.udemy.com/trading-chart-patterns-for-immediate-explosive-gains/,True,95,2917,All Levels,2.5,Business Finance
8,476268,Options Trading 3 : Advanced Stock Profit and Success Method,https://www.udemy.com/day-trading-stock-options-3/,True,195,5172,Expert Level,2.5,Business Finance
9,1167710,The Only Investment Strategy You Need For Your Retirement,https://www.udemy.com/the-only-investment-strategy-you-need-for-your-retirement/,True,200,827,All Levels,1.0,Business Finance
10,592338,Forex Trading Secrets of the Pros With Amazon's AWS,https://www.udemy.com/trading-with-amazons-aws-servers-trade-secrets-of-the-pros/,True,200,4284,All Levels,5.0,Business Finance
11,975046,Trading Options With Money Flow,https://www.udemy.com/trading-options-using-money-flow/,True,200,1380,All Levels,1.0,Business Finance
12,742602,Financial Management Risk and Return For Securities,https://www.udemy.com/risk-and-return-finance/,True,30,3607,All Levels,1.5,Business Finance
13,794151,Forex Trading Course: Work Smarter Not Harder Proven Results,https://www.udemy.com/the-complete-trading-course/,True,195,4061,All Levels,2.0,Business Finance
14,1196544,Python Algo Trading: Sentiment Trading with News,https://www.udemy.com/hedge-fund-strategy-trading-with-sentiment-analysis/,True,200,294,All Levels,7.0,Business Finance
15,504036,Short Selling: Learn To Sell Stocks Before The Fall,https://www.udemy.com/short-selling-learn-to-sell-before-the-fall/,True,75,2276,Intermediate Level,1.5,Business Finance
16,719698,Basic Technical Analysis: Learn the structure of the market,https://www.udemy.com/learn-basic-technical-analysis/,True,20,4919,Beginner Level,1.5,Business Finance
17,564966,The Complete Chart Pattern Trading Course: A Proven Approach,https://www.udemy.com/make-money-trading-stocks-from-home/,True,200,2666,All Levels,4.0,Business Finance
18,606928,7 Deadly Mistakes of Investing that Will Slash Your Profits!,https://www.udemy.com/7-deadly-mistakes-of-investing/,True,50,5354,All Levels,1.5,Business Finance
19,58977,Financial Statements Made Easy,https://www.udemy.com/intro-to-financial-statements-for-entrepreneurs/,True,95,8095,Beginner Level,0.5833333333333334,Business Finance
20,1242604,Winning Forex Trading with Live Forex Trading Examples,https://www.udemy.com/forexmacross/,True,200,809,All Levels,2.0,Business Finance
21,798740,Forex Traders - Create Your First Trading Robot. No Coding!,https://www.udemy.com/launch-your-amazing-forex-robot-in-30-minutes-no-coding/,True,200,2295,All Levels,4.0,Business Finance
22,506568,Create A Business From Home Trading Stocks Today In 2017,https://www.udemy.com/work-from-home-buying-penny-stocks/,True,75,10149,All Levels,2.0,Business Finance
23,1020760,Introduction to Accounting : Mastering Financial Statements,https://www.udemy.com/introduction-to-accounting-mastering-financial-statements/,True,50,1916,Beginner Level,1.0,Business Finance
24,859742,The Complete Ethereum Course: Get .01 Ether In Your Wallet,https://www.udemy.com/ethereum/,True,45,2507,All Levels,2.0,Business Finance
25,383414,Beginner to Pro in PowerPoint: Complete PowerPoint Training,https://www.udemy.com/powerpoint-master-class-for-business-and-finance-graduates/,True,150,5786,All Levels,5.0,Business Finance
26,353044,Investing 101: The Complete Online Investing Course,https://www.udemy.com/online-investing-guide/,True,200,5334,All Levels,4.5,Business Finance
27,447362,Create Your Own Hedge Fund: Trade Stocks Like A Fund Manager,https://www.udemy.com/create-your-own-hedge-fund-double-your-money-every-year/,True,175,4005,Intermediate Level,2.0,Business Finance
28,831066,Learn MQL5: Build an 8-Currency Hedging Robot (MetaTrader 5),https://www.udemy.com/learn-mql5/,True,150,2877,All Levels,4.5,Business Finance
29,1266306,Forex Trading: Your Complete Guide to Get Started Like a Pro,https://www.udemy.com/forex-trading-your-complete-guide-to-get-started-like-a-pro/,True,140,1026,Beginner Level,3.0,Business Finance
30,1170894,Python Algo Stock Trading: Automate Your Trading!,https://www.udemy.com/algorithmic-stock-trading-bootcamp-automate-your-trading/,True,95,1165,Beginner Level,2.5,Business Finance
31,948974,THE Forex Robot: Incredible ROI (Robot Included),https://www.udemy.com/the-forex-robot-1000-annual-profit-robot-included/,True,200,1843,All Levels,1.5,Business Finance
32,380970,The Complete Bitcoin Course: Get .001 Bitcoin In Your Wallet,https://www.udemy.com/bitcoin-for-beginners/,True,45,8797,All Levels,6.5,Business Finance
33,1217778,Mastering High Probability Iron Condor Options Trading,https://www.udemy.com/mastering-high-probability-iron-condor-options-trading/,True,200,1030,All Levels,2.0,Business Finance
34,1246208,The Complete Short Course on Ethereum,https://www.udemy.com/ethereum1/,True,200,1041,All Levels,1.5,Business Finance
35,434774,Options Trading Stocks: Proven Toolbox For Financial Success,https://www.udemy.com/trading-stock-options-ii-simplified-strategies-for-success/,True,195,7884,Intermediate Level,10.0,Business Finance
36,308690,Forex Trading A-Z™ - With LIVE Examples of Forex Trading,https://www.udemy.com/forex-trading/,True,195,16900,Beginner Level,5.5,Business Finance
37,888716,"Introduction to Finance, Accounting, Modeling and Valuation",https://www.udemy.com/introduction-to-accounting-finance-modeling-valuation-by-chris-haroun/,True,200,11441,All Levels,4.5,Business Finance
38,321410,Beginner to Pro in Excel: Financial Modeling and Valuation,https://www.udemy.com/beginner-to-pro-in-excel-financial-modeling-and-valuation/,True,195,22257,All Levels,7.5,Business Finance
39,965832,The Complete Investment Banking Course 2017,https://www.udemy.com/the-complete-investment-banking-course-2016/,True,195,8575,All Levels,5.5,Business Finance
40,648826,The Complete Financial Analyst Course 2017,https://www.udemy.com/the-complete-financial-analyst-course/,True,195,24481,All Levels,10.0,Business Finance
41,1035472,Python for Finance: Investment Fundamentals & Data Analytics,https://www.udemy.com/python-for-finance-investment-fundamentals-data-analytics/,True,195,3811,All Levels,6.5,Business Finance
42,1154754,Financial Modeling for Startups & Small Businesses,https://www.udemy.com/financial-modeling-for-startups-small-businesses/,True,195,4991,Beginner Level,11.5,Business Finance
43,627540,Options Trading - How to Win with Weekly Options,https://www.udemy.com/work-from-home-setup-your-own-options-trading-business/,True,115,7489,Intermediate Level,1.0,Business Finance
44,301442,Black Algo Trading: Build Your Trading Robot,https://www.udemy.com/build-your-trading-robot/,True,200,20195,All Levels,16.0,Business Finance
45,640100,Accounting & Financial Statement Analysis: Complete Training,https://www.udemy.com/accounting-fsa-a-solid-foundation-for-a-career-in-finance/,True,150,10042,All Levels,3.0,Business Finance
46,1247394,Cryptocurrency Trading: Complete Guide To Trading Altcoins,https://www.udemy.com/cryptocurrency-trading/,True,95,367,All Levels,5.0,Business Finance
47,260470,Forex Robots: Expect To Earn 175% P.A. Forex Robot Included!,https://www.udemy.com/backtesting/,True,200,10603,All Levels,5.5,Business Finance
48,1214702,Three Steps Trading - Live Trading - Real Account,https://www.udemy.com/three-steps-trading-live-trading-real-account/,True,190,1197,All Levels,5.0,Business Finance
49,848664,Option Trading for Rookies:  Understand Options Completely,https://www.udemy.com/complete-course-introduction-to-option-trading/,True,150,2893,All Levels,2.0,Business Finance
50,1142570,How I Learned Stock Trading (and How You Can Too),https://www.udemy.com/best-stock-traders/,True,200,1580,Expert Level,2.0,Business Finance
51,325834,Learn to Trade for Profit: Find and Trade Winning Stocks,https://www.udemy.com/trading-stocks-successfully-introduction-to-stock-trading/,True,95,10605,All Levels,3.0,Business Finance
52,411168,Trading Inside Bars - Master 1 Easy Pattern To Be Successful,https://www.udemy.com/trading-inside-bars-find-setups-today-make-money-tomorrow/,True,125,2996,Intermediate Level,2.0,Business Finance
53,885974,Four Fundamentals of Financial Planning,https://www.udemy.com/four-fundamentals-of-financial-planning/,True,30,6219,All Levels,1.0,Business Finance
54,1151092,Options Trading - Calendar Spread Course for Every Trader,https://www.udemy.com/options-trading-calendar-spread-course-for-every-trader/,True,200,1113,All Levels,1.5,Business Finance
55,358326,Dividend Investing: Build Your Portfolio for a Better Future,https://www.udemy.com/dividend-investing/,True,60,8314,Beginner Level,4.0,Business Finance
56,153210,Learn Accounting. Understand Business.,https://www.udemy.com/learn-accounting-understand-business/,True,200,5572,Beginner Level,5.5,Business Finance
57,834836,How to Consistently Win Trading Stocks in 30 Days or Less,https://www.udemy.com/winningstocktrades/,True,145,1433,Intermediate Level,1.0,Business Finance
58,1171994,A Beginner's Guide to Quantopian Futures API,https://www.udemy.com/quantopian-futures/,True,20,936,Intermediate Level,1.5,Business Finance
59,1239068,How to Buy Cheap Options - Options Trading Pricing Model,https://www.udemy.com/options-black-scholes-model/,True,200,658,All Levels,1.0,Business Finance
60,985922,Excel Crash Course: Master Excel for Financial Analysis,https://www.udemy.com/excel-crash-course-master-excel-for-financial-analysis/,True,105,8121,All Levels,3.5,Business Finance
61,765562,"Comprehensive Guide to Financial Markets, Investing &Trading",https://www.udemy.com/financial-markets-a-to-z-for-beginners/,True,60,4187,Beginner Level,9.0,Business Finance
62,165964,Stock Trading Ninja: Complete System For Trading Success,https://www.udemy.com/stock-trading-ninja-learn-how-to-make-money-trading-stocks/,True,155,9445,All Levels,4.5,Business Finance
63,855172,Hedge and Mutual Fund Careers: The Complete Guide,https://www.udemy.com/hedge-fund-mutual-fund-careers-the-complete-guide-how-to-pick-stocks/,True,200,3255,All Levels,8.5,Business Finance
64,258232,Algorithmic Trading In Forex: Create Your First Forex Robot!,https://www.udemy.com/learn-mql4/,True,185,7941,All Levels,6.5,Business Finance
65,994754,The Power Modeling Bootcamp: Advanced Excel in 10 Days,https://www.udemy.com/the-power-modeling-bootcamp-advanced-excel-in-10-days/,True,150,1680,All Levels,5.5,Business Finance
66,43319,Options Trading Basics (3-Course Bundle),https://www.udemy.com/learn-options-trading-courses/,True,180,10100,Beginner Level,11.0,Business Finance
67,408440,How to Win 97% of Your Options Trades,https://www.udemy.com/how-to-win-97-percent-of-your-trades/,True,125,5050,All Levels,1.5,Business Finance
68,918688,How I Make Consistent Returns Trading Options,https://www.udemy.com/how-i-make-15-per-month-trading-options/,True,200,2310,All Levels,3.5,Business Finance
69,308694,"Forex Strategies: Kelly Criterion, Larry Williams and more!",https://www.udemy.com/money-management/,True,185,5528,All Levels,3.0,Business Finance
70,199450,"Elite Trend Trader: Learn To Trade Stocks, Options & Forex",https://www.udemy.com/elite-trend-trader-how-to-make-a-fortune-trading-the-trend/,True,125,6451,All Levels,5.0,Business Finance
71,401784,Options Trading Introduction: Day Trade Stock Options,https://www.udemy.com/how-to-trade-stock-options-level-1-start-day-trading/,True,95,12394,Beginner Level,2.5,Business Finance
72,1122792,The Almost Perfect Options Trading Strategy System - Unique,https://www.udemy.com/the-almost-perfect-options-trading-strategy-system-unique/,True,200,1793,All Levels,1.0,Business Finance
73,709500,Forex Trading -  Learn to Trade Forex Like the Banks,https://www.udemy.com/forex-trading-learn-the-same-strategies-used-by-banks/,True,20,3223,All Levels,1.0,Business Finance
74,285638,Learn to Trade for Profit:Trading with Japanese Candlesticks,https://www.udemy.com/introduction-to-japanese-candlesticks/,True,60,16385,Beginner Level,3.0,Business Finance
75,1135126,The Most Powerful Options Spread Trading Front Ratio Spread,https://www.udemy.com/the-most-powerful-options-spread-trading-front-ratio-spread/,True,200,1487,All Levels,2.0,Business Finance
76,834558,What Finance Job is for You? Explanation of 14 Finance Roles,https://www.udemy.com/what-finance-job-is-for-you-explanation-of-14-financial-analyst-roles/,True,200,2951,All Levels,4.0,Business Finance
77,551968,The Blueprint for Successful Stock Trading,https://www.udemy.com/stock-market-millionaire-blueprint/,True,120,2697,All Levels,1.0,Business Finance
78,1005658,Trading for Beginners - Intermediate Level,https://www.udemy.com/trading-for-beginners-tier-2/,True,150,3979,Beginner Level,5.0,Business Finance
79,746432,Start Trading Stocks Using Technical Analysis!,https://www.udemy.com/professional-stock-trader/,True,25,3190,All Levels,4.0,Business Finance
80,1057242,Learn How to Set Up an Incubator Hedge Fund - Step-by-Step,https://www.udemy.com/hedge-fund-startup/,True,200,1406,Expert Level,1.5,Business Finance
81,284118,VPS for Forex Trading - Protect Your Forex Robots,https://www.udemy.com/forex-vps/,True,160,4252,All Levels,2.0,Business Finance
82,302562,Introduction to Accounting: The Language of Business,https://www.udemy.com/learnaccountingforfree/,True,20,11958,Beginner Level,11.5,Business Finance
83,596598,Basic Excel for Basic Bookkeeping and Accounting,https://www.udemy.com/basic-excel-for-basic-bookkeeping/,True,95,7743,Beginner Level,1.5,Business Finance
84,860890,"Using 'The Greeks To Understand Options""",https://www.udemy.com/options-greeks/,True,50,2134,All Levels,1.0,Business Finance
85,951050,Trading Options For Consistent Returns: Calendar Spreads,https://www.udemy.com/trading-options-for-consistent-returns-calendar-spreads/,True,200,1214,All Levels,1.5,Business Finance
86,796450,How to Create Your Personal Budget,https://www.udemy.com/personal-budget/,True,20,3870,All Levels,1.0,Business Finance
87,502772,The Complete Value Investing Course: A Proven Approach,https://www.udemy.com/value-investing-essential-guide-to-picking-stocks/,True,200,2146,All Levels,4.5,Business Finance
88,1102462,FOREX Trading with Price Action,https://www.udemy.com/forex-trading-system/,True,195,484,Beginner Level,1.0,Business Finance
89,1062092,Emini ES Futures - Advanced Non Directional Options Trading,https://www.udemy.com/emini-es-futures-advanced-non-directional-options-trading/,True,200,1057,All Levels,1.5,Business Finance
90,891484,Forex Trading - Advanced Fundamental Analysis,https://www.udemy.com/forex-trading-advanced-fundamental-analysis/,True,20,1754,Intermediate Level,2.5,Business Finance
91,1217064,How To Invest With Tiny Capital In Stocks ?,https://www.udemy.com/howtoinvest5k/,True,20,1239,Beginner Level,0.7,Business Finance
92,382204,Learn How To Successfully Trade Stocks: In 5 Simple Steps,https://www.udemy.com/learn-how-to-successfully-trade-stocks-in-5-simple-steps/,True,95,2493,All Levels,9.5,Business Finance
93,308696,Forex MetaTrader 4: Master MT4 Like A Pro Forex Trader,https://www.udemy.com/metatrader4/,True,150,2602,Beginner Level,5.0,Business Finance
94,474928,Intermediate Options trading concepts for Stocks and Options,https://www.udemy.com/intermediate-options-trading-concepts-for-stocks-and-options-traders/,True,40,2000,All Levels,1.0,Business Finance
95,1148774,Options Trading 101: The Basics,https://www.udemy.com/options-trading-101-the-basics/,False,0,1514,Beginner Level,0.55,Business Finance
96,959144,Practical Accounts APP Overview,https://www.udemy.com/practical-accounts-app-overview/,True,20,1361,Intermediate Level,3.0,Business Finance
97,1233350,Bitcoin Profits for Beginners,https://www.udemy.com/bitcoin-profits-for-beginners/,True,100,61,Beginner Level,1.5,Business Finance
98,572744,Trend Traders Club: How To Find And Trade Fast Moving Trends,https://www.udemy.com/how-to-find-and-trade-profitable-fast-moving-trends/,True,75,1513,All Levels,5.5,Business Finance
99,724062,Financial Statements Basics,https://www.udemy.com/financial-statements-basics/,True,20,1374,Beginner Level,2.0,Business Finance
100,474212,High performance Stock Trading using key Options techniques,https://www.udemy.com/high-performance-stock-trading-using-options-trading-techniques/,True,40,2103,All Levels,1.5,Business Finance
101,771276,Introduction to Financial Statement Analysis,https://www.udemy.com/introduction-to-financial-statement-analysis/,True,20,1480,Beginner Level,1.5,Business Finance
102,388164,Basics of Economics (College Level),https://www.udemy.com/economics-for-accounting-and-finance-professionals/,True,25,2516,All Levels,1.5,Business Finance
103,133536,Stock Market Investing for Beginners,https://www.udemy.com/the-beginners-guide-to-the-stock-market/,False,0,50855,Beginner Level,1.5,Business Finance
104,655300,Accounting for Beginners : Learn Basics in under 1 Hour,https://www.udemy.com/accounting-for-beginners-how-to-do-accounting-super-easily/,True,50,1971,Beginner Level,1.5,Business Finance
105,949504,Straddle Options Trading - Profit in Any Market Direction,https://www.udemy.com/straddle-options-trading-profit-in-any-market-direction/,True,200,837,All Levels,1.0,Business Finance
106,265960,Fundamentals of Forex Trading,https://www.udemy.com/fundamentals-of-forex-trading/,False,0,17160,All Levels,1.0,Business Finance
107,680044,"Binary Options: Trading Strategies, 90% Accuracy and Signals",https://www.udemy.com/learn-trading-binary-options-from-scratch-and-3-strategies/,True,195,1723,Beginner Level,1.0,Business Finance
108,923616,Website Investing 101 - Buying & Selling Online Businesses,https://www.udemy.com/cash-flow-website-investing-buy-sell-online-businesses-digital-assets/,False,0,6811,All Levels,2.0,Business Finance
109,741898,Practical Accounts & Bookkeeping Automated Overview ,https://www.udemy.com/practical-accounts-bookkeeping-automated-overview/,True,20,2060,All Levels,4.5,Business Finance
110,381330,Live Account - ETF Trading System - Hacking The Stock Market,https://www.udemy.com/cracked-wall-street-hacked-the-stock-market-top-secret/,True,150,2318,All Levels,5.0,Business Finance
111,545918,Stock Market Leverage: How to Start Trading Options Wisely,https://www.udemy.com/stock-market-tips-how-to-successfully-trade-options/,True,95,2153,Beginner Level,1.5,Business Finance
112,191854,Stock Market Foundations,https://www.udemy.com/how-to-invest-in-the-stock-market-beginners/,False,0,19339,Beginner Level,2.0,Business Finance
113,471546,Crash Course on Working Capital Management,https://www.udemy.com/crash-course-on-working-capital-management/,True,20,3177,All Levels,1.0,Business Finance
114,866584,Advanced Accounting A Complete Study for CA / CMA / CFA / CS,https://www.udemy.com/branch-accounts-a-complete-analysis/,True,150,1535,All Levels,62.0,Business Finance
115,889824,61% Profit In 1 Month - Crush Your Forex Trading Paradigm,https://www.udemy.com/61-profit-in-1-month-shattering-your-trading-paradigm/,True,20,1027,All Levels,1.5,Business Finance
116,1191504,How to create a routine Trading,https://www.udemy.com/how-to-create-a-trading-routine/,True,25,307,All Levels,0.1333333333333333,Business Finance
117,585752,"Forex Trading Secrets |MT4 Robot (EA) inside, no coding",https://www.udemy.com/forex-trading-robot-forex-trading/,True,150,2096,All Levels,0.6833333333333333,Business Finance
118,671578,Forex SOS Course: Trading Tweaks And Working Forex Strategy,https://www.udemy.com/forex-sos-course/,True,50,1315,Beginner Level,2.5,Business Finance
119,151668,Introduction to Financial Modeling,https://www.udemy.com/financial-modeling-asimplemodel/,False,0,29167,Intermediate Level,1.5,Business Finance
120,1105344,Quantitative Aptitude for Banking & Competitive Examinations,https://www.udemy.com/quantitative-aptitude-for-competitive-examinations-part-i/,True,50,1056,All Levels,3.0,Business Finance
121,44836,Option Spreads and Credit Spreads Bundle,https://www.udemy.com/option-spreads-and-credit-spreads-bundle/,True,180,2212,Expert Level,4.5,Business Finance
122,840300,B Com Accountancy I (Paper ECO 02 IGNOU),https://www.udemy.com/accounts-from-incomplete-records/,True,50,2946,All Levels,31.5,Business Finance
123,1100054,FOREX TRADING - Learn in a quick + profitable way + support,https://www.udemy.com/forex-the-only-simple-trading-your-ever-need-bank-trading/,True,100,271,All Levels,3.5,Business Finance
124,421054,Auditing Basics (Professional Course Level),https://www.udemy.com/basics-of-auditing/,True,25,3771,All Levels,2.5,Business Finance
125,528784,Stock market Investing Encyclopedia: How to invest in stocks,https://www.udemy.com/stockmarket/,True,200,3143,Intermediate Level,3.0,Business Finance
126,637430,Learn the basics of preparing accounting statements,https://www.udemy.com/basics-of-financial-accounting/,True,20,1951,Intermediate Level,0.55,Business Finance
127,236080,Elliott Wave -Forex Trading With The Elliott Wave Theory,https://www.udemy.com/forex-trading-with-the-elliot-wave-theory/,True,90,4022,Expert Level,1.0,Business Finance
128,777444,Corporate Finance - A Brief Introduction,https://www.udemy.com/finance-a-brief-introduction-and-basics-finance-101/,False,0,11724,Beginner Level,1.5,Business Finance
129,474238,Excel functions to analyze and visualize data,https://www.udemy.com/basic-excel-functions-to-analyze-large-data/,True,20,2283,Intermediate Level,2.0,Business Finance
130,1245244,Building Financial Statements in Excel,https://www.udemy.com/guide-to-building-financial-statements/,True,35,1181,Beginner Level,1.0,Business Finance
131,1051570,Transfer Pricing A Complete Analysis,https://www.udemy.com/transfer-pricing-a-complete-analysis/,True,50,1852,All Levels,2.5,Business Finance
132,262370,Accounting: Get Hired Without Work Experience,https://www.udemy.com/accounting-get-hired-without-work-experience/,True,100,4661,All Levels,1.0,Business Finance
133,1188178,Forex Trading for Beginners - Basics,https://www.udemy.com/complete-forex-trading-for-beginners-in-1-course-basics/,True,50,989,All Levels,1.0,Business Finance
134,824592,Basic Bookkeeping Hacks,https://www.udemy.com/basic-bookkeeping/,True,20,5841,All Levels,1.5,Business Finance
135,1147458,Complete Trading Plan Course for Stocks & Forex (10 Hours),https://www.udemy.com/killer-trading-plan-6-year-old-can-invest-10-hours-stocks-forex-etf/,True,200,1087,All Levels,9.5,Business Finance
136,1243448,"Forex Trading with Fixed 'Risk through Options Trading""",https://www.udemy.com/forexoptions/,True,200,611,Beginner Level,1.0,Business Finance
137,730414,"Intro to Investment Banking, M&A, IPO, Modeling + Free Book",https://www.udemy.com/investment-banking-mergers-ipo-financial-model-business-mba-pro-forma/,True,60,1922,All Levels,20.0,Business Finance
138,252396,How to Pick The Right Penny Stocks To Invest In 2017,https://www.udemy.com/how-to-make-5000month-trading-penny-stocks/,True,150,9015,All Levels,2.5,Business Finance
139,1198166,Top 10 Trading Ideas in the Equities Market,https://www.udemy.com/top-10-trading-ideas-in-the-equities-market/,True,20,661,All Levels,1.0,Business Finance
140,920604,Intro to Financial Modeling,https://www.udemy.com/intro-to-financial-modeling/,True,105,1077,Beginner Level,6.0,Business Finance
141,215728,Shark Accounting - Building a Business by the Numbers!,https://www.udemy.com/shark-accounting/,True,20,6050,Beginner Level,1.5,Business Finance
142,722174,Forex Trading MAKE YOUR FIRST TRADE TODAY!,https://www.udemy.com/trade-forex/,True,150,3523,All Levels,4.0,Business Finance
143,48841,Accounting in 60 Minutes - A Brief Introduction,https://www.udemy.com/accounting-in-60-minutes-a-brief-introduction/,False,0,56659,Beginner Level,1.5,Business Finance
144,907444,SAP FICO For Beginners - A Guide to SAP Financial Accounts,https://www.udemy.com/sap-fico-for-sap-beginners/,True,100,1444,Beginner Level,5.0,Business Finance
145,317030,Learn how to double your Forex Trading Account in one trade,https://www.udemy.com/learn-how-to-double-your-forex-trading-account-in-one-trade/,True,60,2900,Intermediate Level,2.5,Business Finance
146,891490,"Accounting Superpowers: Learn Accounts, Understand Business!",https://www.udemy.com/accounting-basics-for-success-in-business-and-in-life/,True,200,1437,Beginner Level,2.5,Business Finance
147,1070886,Python Algo Trading: FX Trading with Oanda,https://www.udemy.com/python-algo-trading-fx-trading-with-oanda/,True,200,453,Intermediate Level,3.0,Business Finance
